{
  "schema_version": 1,
  "record_id": "k4-ribosembly-100k256-ac5177d2-a100",
  "recorded_at": "2026-09-01T12:00:00-04:00",
  "record_type": "accepted_reference",
  "subject": {
    "kind": "synthetic",
    "name": "Ribosembly four-state completion fixture",
    "k": 4,
    "particles": 100000,
    "box_size": 256,
    "pixel_size_angstrom": 2.125,
    "symmetry": "C1"
  },
  "dataset": {
    "root": "/scratch/gpfs/GILLES/mg6942/em_relion_proj/ribosembly_k4_g256_n100000_completion_20260512_171123",
    "provenance_status": "RECONSTRUCTED_FROM_CONFIG",
    "description": "Four Ribosembly states (PDB 8c9c, 8c9b, 8c9a, 8c99), white noise level 1, B factor 80, cubic discretization, synthetic seed 42. The particle stack and all consumed maps are sealed, but the original PDB staging paths are gone and the historical generator command was not sealed.",
    "generation_config": {
      "path": "/scratch/gpfs/GILLES/mg6942/em_relion_proj/ribosembly_k4_g256_n100000_completion_20260512_171123/generation_config.json",
      "sha256": "e88514d680db1ff6d8d6170d1469934ad0cbd994f36a8d34a0dab0a258ee368a"
    },
    "class_manifest": {
      "path": "/scratch/gpfs/GILLES/mg6942/em_relion_proj/ribosembly_k4_g256_n100000_completion_20260512_171123/class_manifest.json",
      "sha256": "c4495035053e0b075e2b2a46a2a6b5f14e17bb928bd93a6880a7765cc2369ae3"
    }
  },
  "source": {
    "recovar": {
      "commit": "ac5177d2b0cd639db7ed6f14225d80fe9cff7d4d",
      "tree": "58476f9eb7f3ffced81c2d3a70d9083e307db197",
      "checkout": "/scratch/gpfs/CRYOEM/gilleslab/mg6942/em_dev/recovar_ac5177d2_em_accept_20260719",
      "clean": true
    },
    "relion": {
      "commit": "d476e6f6a4f1f37627c06ace5227fc374c0c2b05",
      "executable": {
        "path": "/scratch/gpfs/CRYOEM/gilleslab/mg6942/em_dev/relion_k4_100k_dispatchv2_20260717/build/bin/relion_refine_mpi",
        "sha256": "01fa9cc870fdce6c19d981d6e917765753406972abcddb0311a40ef88e69a782"
      },
      "source_diff_sha256": "6987c5ce397cbdd98835682cf1481a150c38c48cda621e006341d01a77e11c11"
    }
  },
  "workload": {
    "iterations": 15,
    "seed": 1778628798,
    "trajectory_scope": "Fully autonomous after exact RELION iteration-0 model bootstrap; RELION and RECOVAR run sequentially on one physical A100.",
    "parameters": {
      "n_classes": 4,
      "healpix_order": 1,
      "offset_range": 6,
      "offset_step": 2,
      "adaptive_oversampling": 1,
      "init_resolution_angstrom": 60.0,
      "particle_diameter_angstrom": 380,
      "tau2_fudge": 4.0,
      "firstiter_cc": true,
      "apply_initial_lowpass": true,
      "image_batch_size": 50,
      "rotation_block_size": 2000,
      "final_all_data_after_nonconvergence": false,
      "final_all_data_grid_correct": false
    },
    "recovar_command": "/scratch/gpfs/CRYOEM/gilleslab/em_work/codex/em_k4_100k_restartfix_030f4a0b_20260717T211041Z/venv/bin/python -m scripts.run_full_refinement --data_dir /scratch/gpfs/GILLES/mg6942/em_relion_proj/ribosembly_k4_g256_n100000_completion_20260512_171123 --output /scratch/gpfs/CRYOEM/gilleslab/em_work/codex/em_k4_100k_guigrid_localhighshell_samegpu_accept_ac5177d2_20260719T173500Z/recovar --max_iter 15 --n_classes 4 --healpix_order 1 --offset_range 6 --offset_step 2 --adaptive_oversampling 1 --init_resolution 60.0 --apply-initial-lowpass --firstiter_cc --image_batch_size 50 --rotation_block_size 2000 --seed 1778628798 --relion_optimiser /scratch/gpfs/CRYOEM/gilleslab/em_work/codex/em_k4_100k_guigrid_localhighshell_samegpu_accept_ac5177d2_20260719T173500Z/relion/run_it015_optimiser.star --relion_init_dir /scratch/gpfs/CRYOEM/gilleslab/em_work/codex/em_k4_100k_guigrid_localhighshell_samegpu_accept_ac5177d2_20260719T173500Z/relion --relion-dispatch-schedule /scratch/gpfs/CRYOEM/gilleslab/em_work/codex/em_k4_100k_guigrid_localhighshell_samegpu_accept_ac5177d2_20260719T173500Z/relion/dispatch_schedule_schema3_resolved_full15.npz --particle_diameter_ang 380 --tau2_fudge 4.0 --save_intermediates_dir /scratch/gpfs/CRYOEM/gilleslab/em_work/codex/em_k4_100k_guigrid_localhighshell_samegpu_accept_ac5177d2_20260719T173500Z/recovar/intermediates --save_intermediates_skip_unregularized --benchmark_ledger_json /scratch/gpfs/CRYOEM/gilleslab/em_work/codex/em_k4_100k_guigrid_localhighshell_samegpu_accept_ac5177d2_20260719T173500Z/recovar/benchmark_ledger.json --timing_dir /scratch/gpfs/CRYOEM/gilleslab/em_work/codex/em_k4_100k_guigrid_localhighshell_samegpu_accept_ac5177d2_20260719T173500Z/recovar/timing",
    "relion_command": "srun --ntasks=3 --cpus-per-task=4 --cpu-bind=none /scratch/gpfs/CRYOEM/gilleslab/mg6942/em_dev/relion_k4_100k_dispatchv2_20260717/build/bin/relion_refine_mpi --i /scratch/gpfs/GILLES/mg6942/em_relion_proj/ribosembly_k4_g256_n100000_completion_20260512_171123/particles.star --ref /scratch/gpfs/GILLES/mg6942/em_relion_proj/ribosembly_k4_g256_n100000_completion_20260512_171123/reference_init_classes_relion.star --o /scratch/gpfs/CRYOEM/gilleslab/em_work/codex/em_k4_100k_guigrid_localhighshell_samegpu_accept_ac5177d2_20260719T173500Z/relion/run --iter 15 --tau2_fudge 4 --particle_diameter 380 --K 4 --flatten_solvent --zero_mask --ctf --norm --scale --sym C1 --oversampling 1 --healpix_order 1 --offset_range 6 --offset_step 2 --pad 2 --pool 3 --trust_ref_size --firstiter_cc --ini_high 60 --dont_combine_weights_via_disc --gpu 0:0:0 --j 4 --random_seed 1778628798"
  },
  "inputs": [
    {"role": "particles", "path": "/scratch/gpfs/GILLES/mg6942/em_relion_proj/ribosembly_k4_g256_n100000_completion_20260512_171123/particles.256.mrcs", "sha256": "df19cb8b0287629d293a478d2002205448fca97bc448e6e5a7b4829f2f42575e", "size_bytes": 26214401024},
    {"role": "particle_metadata", "path": "/scratch/gpfs/GILLES/mg6942/em_relion_proj/ribosembly_k4_g256_n100000_completion_20260512_171123/particles.star", "sha256": "eea55f4e50c7c6c08d8df1b62820e948ff33bdb6f92135bfbafe9253a073b833", "size_bytes": 13859127},
    {"role": "relion_initial_model_manifest", "path": "/scratch/gpfs/GILLES/mg6942/em_relion_proj/ribosembly_k4_g256_n100000_completion_20260512_171123/reference_init_classes_relion.star", "sha256": "b5df1127685fcaddb4422a9c5da1980d6483ac478ca6b51a3382b4a5666ada95", "size_bytes": 337},
    {"role": "initial_class_1", "path": "/scratch/gpfs/GILLES/mg6942/em_relion_proj/ribosembly_k4_g256_n100000_completion_20260512_171123/reference_init_class001.mrc", "sha256": "a3aea3129aadd4aa50244e89f9319bf2cc01d778926dffa8fe93d78e64a2444c", "size_bytes": 67109888},
    {"role": "initial_class_2", "path": "/scratch/gpfs/GILLES/mg6942/em_relion_proj/ribosembly_k4_g256_n100000_completion_20260512_171123/reference_init_class002.mrc", "sha256": "ef301451ef202ceec8de522d9fd95e8745bfb27c19a79c5a28cce482f3693fb7", "size_bytes": 67109888},
    {"role": "initial_class_3", "path": "/scratch/gpfs/GILLES/mg6942/em_relion_proj/ribosembly_k4_g256_n100000_completion_20260512_171123/reference_init_class003.mrc", "sha256": "222f03a227209445a8c9c20519ab67d4b425336e07b54e3c1b44de1ea9bb4829", "size_bytes": 67109888},
    {"role": "initial_class_4", "path": "/scratch/gpfs/GILLES/mg6942/em_relion_proj/ribosembly_k4_g256_n100000_completion_20260512_171123/reference_init_class004.mrc", "sha256": "90b8b878acf4974436b328fca9936d1fb3c48f49465c3a1366c6d81fb4c21c7d", "size_bytes": 67109888},
    {"role": "ground_truth_class_1", "path": "/scratch/gpfs/GILLES/mg6942/em_relion_proj/ribosembly_k4_g256_n100000_completion_20260512_171123/reference_gt_class001.mrc", "sha256": "7cf5598595c4f0b10f619cd0979926c38289b0fced7fcb7436fae61bd5abc79d", "size_bytes": 67109888},
    {"role": "ground_truth_class_2", "path": "/scratch/gpfs/GILLES/mg6942/em_relion_proj/ribosembly_k4_g256_n100000_completion_20260512_171123/reference_gt_class002.mrc", "sha256": "54546fe41c3077595c4c5404bdb12fca22873f918da524127bb0e00e77b55653", "size_bytes": 67109888},
    {"role": "ground_truth_class_3", "path": "/scratch/gpfs/GILLES/mg6942/em_relion_proj/ribosembly_k4_g256_n100000_completion_20260512_171123/reference_gt_class003.mrc", "sha256": "0e29345d56995fff4ae7e4e0aca493d0d04cd76226649cd152c2eb472cf5aea6", "size_bytes": 67109888},
    {"role": "ground_truth_class_4", "path": "/scratch/gpfs/GILLES/mg6942/em_relion_proj/ribosembly_k4_g256_n100000_completion_20260512_171123/reference_gt_class004.mrc", "sha256": "2d20f04d4b5a62a93cd4a462872133da018a0ba951eab99310accc2a9154a6a5", "size_bytes": 67109888}
  ],
  "execution": {
    "jobs": [
      {
        "role": "same_gpu_relion_then_recovar",
        "job_id": "11386135",
        "status": "COMPLETED",
        "exit_code": "0:0",
        "elapsed_s": 39151,
        "node": "della-l08g3",
        "gpu_model": "NVIDIA A100-SXM4-80GB",
        "gpu_uuid": "GPU-98fb77aa-8391-8a59-9417-606deb654b53",
        "req_tres": "billing=40,cpu=12,gres/gpu=1,mem=500G,node=1",
        "alloc_tres": "billing=40,cpu=12,gres/gpu=1,mem=500G,node=1",
        "max_rss_kib": 85154420,
        "logs": [
          "/scratch/gpfs/CRYOEM/gilleslab/em_work/codex/em_k4_100k_guigrid_localhighshell_samegpu_accept_ac5177d2_20260719T173500Z/logs/science_11386135.out",
          "/scratch/gpfs/CRYOEM/gilleslab/em_work/codex/em_k4_100k_guigrid_localhighshell_samegpu_accept_ac5177d2_20260719T173500Z/logs/science_11386135.err"
        ]
      },
      {
        "role": "cpu_audit_and_seal",
        "job_id": "11386136",
        "status": "COMPLETED",
        "exit_code": "0:0",
        "elapsed_s": 4165,
        "node": "della-h17n3",
        "gpu_model": null,
        "gpu_uuid": null,
        "req_tres": "billing=62,cpu=8,mem=250G,node=1",
        "alloc_tres": "billing=62,cpu=8,mem=250G,node=1",
        "max_rss_kib": 4760744,
        "logs": [
          "/scratch/gpfs/CRYOEM/gilleslab/em_work/codex/em_k4_100k_guigrid_localhighshell_samegpu_accept_ac5177d2_20260719T173500Z/logs/audit_11386136.out",
          "/scratch/gpfs/CRYOEM/gilleslab/em_work/codex/em_k4_100k_guigrid_localhighshell_samegpu_accept_ac5177d2_20260719T173500Z/logs/audit_11386136.err"